Thank you. Thank you very much, everybody. Sorry to keep you waiting. Complicated business. Complicated. Thank you very much.
I've just received a call from Secretary Clinton. She congratulated us. It's about us. On our victory, and I congratulated her and her family on a very, very hard-fought campaign.
I mean, she fought very hard. Hillary has worked very long and very hard over a long period of time, and we owe her a major debt of gratitude for her service to our country.
I mean that very sincerely. Now it is time for America to bind the wounds of division, have to get together. To all Republicans and Democrats and independents across this nation, I say it is time for us to come together as one united people.
It is time. I pledge to every citizen of our land that I will be President for all of Americans, and this is so important to me. For those who have chosen not to support me in the past, of which there were a few people, I'm reaching out to you for your guidance and your help so that we can work together and unify our great country.
As I've said from the beginning, ours was not a campaign but rather an incredible and great movement, made up of millions of hard-working men and women who love their country and want a better, brighter future for themselves and for their family.
It is a movement comprised of Americans from all races, religions, backgrounds, and beliefs, who want and expect our government to serve the people -- and serve the people it will.
Working together, we will begin the urgent task of rebuilding our nation and renewing the American dream. I've spent my entire life in business, looking at the untapped potential in projects and in people all over the world.
That is now what I want to do for our country. Tremendous potential. I've gotten to know our country so well. Tremendous potential. It is going to be a beautiful thing. Every single American will have the opportunity to realize his or her fullest potential.
The forgotten men and women of our country will be forgotten no longer.
We are going to fix our inner cities and rebuild our highways, bridges, tunnels, airports, schools, hospitals. We're going to rebuild our infrastructure, which will become, by the way, second to none. And we will put millions of our people to work as we rebuild it.
We will also finally take care of our great veterans who have been so loyal, and I've gotten to know so many over this 18-month journey.The time I've spent with them during this campaign has been among my greatest honors. Our veterans are incredible people.
We will embark upon a project of national growth and renewal. I will harness the creative talents of our people, and we will call upon the best and brightest to leverage their tremendous talent for the benefit of all. It is going to happen.
We have a great economic plan. We will double our growth and have the strongest economy anywhere in the world. At the same time, we will get along with all other nations willing to get along with us. We will be. We will have great relationships. We expect to have great, great relationships.
No dream is too big, no challenge is too great. Nothing we want for our future is beyond our reach.
America will no longer settle for anything less than the best. We must reclaim our country's destiny and dream big and bold and daring. We have to do that. We're going to dream of things for our country, and beautiful things and successful things once again.
I want to tell the world community that while we will always put America's interests first, we will deal fairly with everyone, with everyone. All people and all other nations.
We will seek common ground, not hostility; partnership, not conflict.
And now I would like to take this moment to thank some of the people who really helped me with this, what they are calling tonight a very, very historic victory.
First, I want to thank my parents, who I know are looking down on me right now. Great people. I've learned so much from them. They were wonderful in every regard. Truly great parents.
I also want to thank my sisters, Marianne and Elizabeth, who are here with us tonight. Where are they? They're here someplace. They're very shy, actually.
And my brother Robert, my great friend. Where is Robert? Where is Robert?
My brother Robert, and they should be on this stage, but that's okay. They're great.
And also my late brother Fred, great guy. Fantastic guy. Fantastic family. I was very lucky.
Great brothers, sisters, great, unbelievable parents.
To Melania and Don and Ivanka and Eric and Tiffany and Barron, I love you and I thank you, and especially for putting up with all of those hours. This was tough.
This was tough. This political stuff is nasty, and it is tough.
So I want to thank my family very much. Really fantastic. Thank you all. Thank you all. Lara, unbelievable job. Unbelievable. Vanessa, thank you. Thank you very much. What a great group.
You've all given me such incredible support, and I will tell you that we have a large group of people. You know, they kept saying we have a small staff. Not so small. Look at all of the people that we have. Look at all of these people.
And Kellyanne and Chris and Rudy and Steve and David. We have got tremendously talented people up here, and I want to tell you it's been very, very special.
I want to give a very special thanks to our former mayor, Rudy Giuliani. He's unbelievable. Unbelievable. He traveled with us and he went through meetings, and Rudy never changes. Where is Rudy. Where is he?
Gov. Chris Christie, folks, was unbelievable. Thank you, Chris. The first man, first senator, first major, major politician. Let me tell you, he is highly respected in Washington because he is as smart as you get.
Sen. Jeff Sessions. Where is Jeff? A great man. Another great man, very tough competitor. He was not easy. He was not easy. Who is that? Is that the mayor that showed up? Is that Rudy?
Up here. Really a friend to me, but I'll tell you, I got to know him as a competitor because he was one of the folks that was negotiating to go against those Democrats, Dr. Ben Carson. Where's Ben? Where is Ben? By the way, Mike Huckabee is here someplace, and he is fantastic. Mike and his family Sarah, thank you very much. Gen. Mike Flynn. Where is Mike? And Gen. Kellogg. We have over 200 generals and admirals that have endorsed our campaign and they are special people.
We have 22 Congressional Medal of Honor people. A very special person who, believe me, I read reports that I wasn't getting along with him. I never had a bad second with him. He's an unbelievable star. He is ... that's right, how did you possibly guess? Let me tell you about Reince. I've said Reince. I know it. I know it. Look at all of those people over there. I know it, Reince is a superstar. I said, they can't call you a superstar, Reince, unless we win it. Like Secretariat. He would not have that bust at the track at Belmont.
Reince is really a star and he is the hardest-working guy, and in a certain way I did this. Reince, come up here. Get over here, Reince.
Boy, oh, boy, oh, boy. It's about time you did this right. My god. Nah, come here. Say something.
Amazing guy. Our partnership with the RNC was so important to the success and what we've done, so I also have to say, I've gotten to know some incredible people.
The Secret Service people. They're tough and they're smart and they're sharp and I don't want to mess around with them, I can tell you. And when I want to go and wave to a big group of people and they rip me down and put me back down in the seat, but they are fantastic people so I want to thank the Secret Service.
And law enforcement in New York City, they're here tonight. These are spectacular people, sometimes underappreciated unfortunately. We appreciate them.
So it's been what they call a historic event, but to be really historic, we have to do a great job, and I promise you that I will not let you down. We will do a great job. We will do a great job. I look very much forward to being your president, and hopefully at the end of two years or three years or four years or maybe even eight years you will say so many of you worked so hard for us, with you. You will say that -- you will say that that was something that you were -- really were very proud to do and I can — thank you very much.
And I can only say that while the campaign is over, our work on this movement is now really just beginning. We're going to get to work immediately for the American people, and we're going to be doing a job that hopefully you will be so proud of your President. You will be so proud. Again, it's my honor.
It's an amazing evening. It's been an amazing two-year period, and I love this country. Thank you.
Thank you very much. Thank you to Mike Pence.
My fellow Americans,
Tonight, I am speaking to you because there is a growing humanitarian and security crisis at our southern border.
Every day, customs and border patrol agents encounter thousands of illegal immigrants trying to enter our country. We are out of space to hold them, and we have no way to promptly return them back home to their country.
America proudly welcomes millions of lawful immigrants who enrich our society and contribute to our nation. But all Americans are hurt by uncontrolled, illegal migration. It strains public resources and drives down jobs and wages. Among those hardest hit are African Americans and Hispanic Americans.
Our southern border is a pipeline for vast quantities of illegal drugs, including meth, heroin, cocaine, and fentanyl. Every week, 300 of our citizens are killed by heroin alone, 90% of which floods across from our southern border. More Americans will die from drugs this year than were killed in the entire Vietnam war.
In the last two years, ICE officers made 266,000 arrests of aliens with criminal records, including those charged or convicted of 100,000 assaults, 30,000 sex crimes, and 4,000 violent killings. Over the years, thousands of Americans have been brutally killed by those who illegally entered our country, and thousands more lives will be lost if we don’t act right now.
Last month, 20,000 migrant children were illegally brought into the United States – a dramatic increase. These children are used as human pawns by vicious coyotes and ruthless gangs. One in three women are sexually assaulted on the dangerous trek up through Mexico. Women and children are the biggest victims, by far, of our broken system.
This is the tragic reality of illegal immigration on our southern border. This is the cycle of human suffering that I am determined to end.
My administration has presented Congress with a detailed proposal to secure the border and stop the criminal gangs, drug smugglers, and human traffickers. It’s a tremendous problem. Our proposal was developed by law enforcement professionals and border agents at the Department of Homeland Security. These are the resources they have requested to properly perform their mission and keep America safe. In fact, safer than ever before.
We will no longer accept politicians who are all talk and no action - constantly complaining but never doing anything about it.
The time for empty talk is over.
Now arrives the hour of action.
Do not allow anyone to tell you that it cannot be done. No challenge can match the heart and fight and spirit of America.
We will not fail. Our country will thrive and prosper again.
We stand at the birth of a new millennium, ready to unlock the mysteries of space, to free the Earth from the miseries of disease, and to harness the energies, industries and technologies of tomorrow.
A new national pride will stir our souls, lift our sights, and heal our divisions.
It is time to remember that old wisdom our soldiers will never forget: that whether we are black or brown or white, we all bleed the same red blood of patriots, we all enjoy the same glorious freedoms, and we all salute the same great American Flag.
And whether a child is born in the urban sprawl of Detroit or the windswept plains of Nebraska, they look up at the same night sky, they fill their heart with the same dreams, and they are infused with the breath of life by the same almighty Creator.
So to all Americans, in every city near and far, small and large, from mountain to mountain, and from ocean to ocean, hear these words:
You will never be ignored again.
Your voice, your hopes, and your dreams, will define our American destiny. And your courage and goodness and love will forever guide us along the way.
Together, we will make America strong again.
We will make America wealthy again.
We will make America proud again.
We will make America safe again.
And, yes, together, we will make America great again.
We will reinforce old alliances and form new ones - and unite the civilised world against radical Islamic terrorism, which we will eradicate completely from the face of the Earth.
At the bedrock of our politics will be a total allegiance to the United States of America, and through our loyalty to our country, we will rediscover our loyalty to each other.
When you open your heart to patriotism, there is no room for prejudice.
The Bible tells us: "How good and pleasant it is when God's people live together in unity."
We must speak our minds openly, debate our disagreements honestly, but always pursue solidarity.
When America is united, America is totally unstoppable.
There should be no fear - we are protected, and we will always be protected.
We will be protected by the great men and women of our military and law enforcement and, most importantly, we will be protected by God.
Finally, we must think big and dream even bigger.
In America, we understand that a nation is only living as long as it is striving.
The proposal from Homeland Security includes cutting-edge technology for detecting drugs, weapons, illegal contraband, and many other things. We have requested more agents, immigration judges, and bed space to process the sharp rise in unlawful migration fuelled by our very strong economy. Our plan also contains an urgent request for humanitarian assistance and medical support.
Furthermore, we have asked Congress to close border security loopholes so that illegal immigrant children can be safely and humanely returned back home.
Finally, as part of an overall approach to border security, law enforcement professionals have requested $5.7 billion for a physical barrier. At the request of Democrats, it will be a steel barrier rather than a concrete wall. This barrier is absolutely critical to border security. It’s also what our professionals at the border want and need. This is just common sense.
The border wall would very quickly pay for itself. The cost of illegal drugs exceeds $500bn a year – vastly more than the $5.7bn we have requested from Congress. The wall will also be paid for, indirectly, by the great new trade deal we have made with Mexico.
Senator Chuck Schumer – who you will be hearing from later tonight – has repeatedly supported a physical barrier in the past, along with many other Democrats. They changed their mind only after I was elected president.
Democrats in Congress have refused to acknowledge the crisis. And they have refused to provide our brave border agents with the tools they desperately need to protect our families and our nation.
But that is the past. And now we are looking only to the future.
We assembled here today are issuing a new decree to be heard in every city, in every foreign capital, and in every hall of power.
From this day forward, a new vision will govern our land.
From this day forward, it's going to be only America First, America First.
Every decision on trade, on taxes, on immigration, on foreign affairs, will be made to benefit American workers and American families.
We must protect our borders from the ravages of other countries making our products, stealing our companies, and destroying our jobs. Protection will lead to great prosperity and strength.
I will fight for you with every breath in my body - and I will never, ever let you down.
America will start winning again, winning like never before.
We will bring back our jobs. We will bring back our borders. We will bring back our wealth. And we will bring back our dreams.
We will build new roads, and highways, and bridges, and airports, and tunnels, and railways all across our wonderful nation.
We will get our people off of welfare and back to work - rebuilding our country with American hands and American labour.
We will follow two simple rules: Buy American and hire American.
We will seek friendship and goodwill with the nations of the world - but we do so with the understanding that it is the right of all nations to put their own interests first.
We do not seek to impose our way of life on anyone, but rather to let it shine as an example - we will shine - for everyone to follow
January 20th, 2017, will be remembered as the day the people became the rulers of this nation again.
The forgotten men and women of our country will be forgotten no longer.
Everyone is listening to you now.
You came by the tens of millions to become part of a historic movement the likes of which the world has never seen before.
At the centre of this movement is a crucial conviction: that a nation exists to serve its citizens.
Americans want great schools for their children, safe neighbourhoods for their families, and good jobs for themselves.
These are the just and reasonable demands of righteous people and a righteous public.
But for too many of our citizens, a different reality exists: Mothers and children trapped in poverty in our inner cities; rusted-out factories scattered like tombstones across the landscape of our nation; an education system, flush with cash, but which leaves our young and beautiful students deprived of all knowledge; and the crime and the gangs and the drugs that have stolen too many lives and robbed our country of so much unrealised potential.
This American carnage stops right here and stops right now.
We are one nation - and their pain is our pain. Their dreams are our dreams; and their success will be our success. We share one heart, one home, and one glorious destiny.
The oath of office I take today is an oath of allegiance to all Americans.
For many decades, we've enriched foreign industry at the expense of American industry;
Subsidised the armies of other countries while allowing for the very sad depletion of our military;
We've defended other nations' borders while refusing to defend our own;
And spent trillions and trillions of dollars overseas while America's infrastructure has fallen into disrepair and decay.
We've made other countries rich while the wealth, strength, and confidence of our country has dissipated over the horizon.
One by one, the factories shuttered and left our shores, with not even a thought about the millions and millions of American workers that were left behind.
The wealth of our middle class has been ripped from their homes and then redistributed all across the world.
The federal government remains shut down for one reason and one reason only: because Democrats will not fund border security.
My administration is doing everything in our power to help those impacted by the situation. But the only solution is for Democrats to pass a spending bill that defends our borders and re-opens the government.
This situation could be solved in a 45-minute meeting. I have invited congressional leadership to the White House tomorrow to get this done. Hopefully, we can rise above partisan politics in order to support national security.
Some have suggested a barrier is immoral. Then why do wealthy politicians build walls, fences, and gates around their homes? They don’t build walls because they hate the people on the outside, but because they love the people on the inside. The only thing that is immoral is the politicians to do nothing and continue to allow more innocent people to be so horribly victimized.
To every member of Congress: pass a bill that ends this crisis.
To every citizen: call Congress and tell them to finally, after all of these decades, secure our border.
This is a choice between right and wrong, justice and injustice. This is about whether we fulfill our sacred duty to the American citizens we serve.
When I took the oath of office, I swore to protect our country. And that is what I will always do, so help me God.
Thank you and goodnight.We, the citizens of America, are now joined in a great national effort to rebuild our country and to restore its promise for all of our people.
Together, we will determine the course of America, and the world, for many, many years to come.
We will face challenges. We will confront hardships. But we will get the job done.
Every four years, we gather on these steps to carry out the orderly and peaceful transfer of power, and we are grateful to President Obama and First Lady Michelle Obama for their gracious aid throughout this transition. They have been magnificent.
Today's ceremony, however, has very special meaning. Because today we are not merely transferring power from one administration to another, or from one party to another - but we are transferring power from Washington, D.C. and giving it back to you, the people.
For too long, a small group in our nation's capital has reaped the rewards of government while the people have borne the cost.
Washington flourished - but the people did not share in its wealth.
Politicians prospered - but the jobs left, and the factories closed.
The establishment protected itself, but not the citizens of our country.
Their victories have not been your victories; their triumphs have not been your triumphs; and while they celebrated in our nation's capital, there was little to celebrate for struggling families all across our land.
That all changes - starting right here, and right now, because this moment is your moment: it belongs to you.
It belongs to everyone gathered here today and everyone watching all across America.
This is your day. This is your celebration.
And this, the United States of America, is your country.
What truly matters is not which party controls our government, but whether our government is controlled by the people.
America’s heart broke the day after Christmas when a young police officer in California was savagely murdered in cold blood by an illegal alien, who just came across the border. The life of an American hero was stolen by someone who had no right to be in our country.
Day after day, precious lives are cut short by those who have violated our borders. In California, an Air Force veteran was raped, murdered, and beaten to death with a hammer by an illegal alien with a long criminal history. In Georgia, an illegal alien was recently charged with murder for killing, beheading, and dismembering his neighbor.
In Maryland, MS-13 gang members who arrived in the United States as unaccompanied minors were arrested and charged last year after viciously stabbing and beating a 16-year-old girl.
Over the last several years, I’ve met with dozens of families whose loved ones were stolen by illegal immigration. I’ve held the hands of the weeping mothers and embraced the grief-stricken fathers. So sad. So terrible. I will never forget the pain in their eyes, the tremble in their voices, and the sadness gripping their souls.
How much more American blood must we shed before Congress does its job?
To those who refuse to compromise in the name of border security, I would ask: imagine if it was your child, your husband, or your wife whose life was so cruelly shattered and totally broken?

Our great American forces are prepared for anything.  Iran appears to be standing down, which is a good thing for all parties concerned and a very good thing for the world.
No American or Iraqi lives were lost because of the precautions taken, the dispersal of forces, and an early warning system that worked very well.  I salute the incredible skill and courage of America’s men and women in uniform.
For far too long — all the way back to 1979, to be exact — nations have tolerated Iran’s destructive and destabilizing behavior in the Middle East and beyond.  Those days are over.  Iran has been the leading sponsor of terrorism, and their pursuit of nuclear weapons threatens the civilized world.  We will never let that happen.
Last week, we took decisive action to stop a ruthless terrorist from threatening American lives.  At my direction, the United States military eliminated the world’s top terrorist, Qasem Soleimani.  As the head of the Quds Force, Soleimani was personally responsible for some of the absolutely worst atrocities.
He trained terrorist armies, including Hezbollah, launching terrorist strikes against civilian targets.  He fueled bloody civil wars all across the region.  He viciously wounded and murdered thousands of U.S. troops, including the planting of roadside bombs that maim and dismember their victims.
Soleimani directed the recent attacks on U.S. personnel in Iraq that badly wounded four service members and killed one American, and he orchestrated the violent assault on the U.S. embassy in Baghdad.  In recent days, he was planning new attacks on American targets, but we stopped him.
Soleimani’s hands were drenched in both American and Iranian blood.  He should have been terminated long ago.  By removing Soleimani, we have sent a powerful message to terrorists: If you value your own life, you will not threaten the lives of our people.
As we continue to evaluate options in response to Iranian aggression, the United States will immediately impose additional punishing economic sanctions on the Iranian regime.  These powerful sanctions will remain until Iran changes its behavior.
In recent months alone, Iran has seized ships in international waters, fired an unprovoked strike on Saudi Arabia, and shot down two U.S. drones.
